Informazioni cronologiche,Indirizzo email,autore,titolo,editrice,costo,n_pagine,ISBN,biografia_autore,url_foto_copertina,sottotitolo,luogo_pubblicazione,anno_pubblicazione
14/05/2018 0.35.38,antonino.galante@gmail.com,"Mimmarosa Barresi, Lorenza Scilipoti",Ghiaccio a colazione,Giambra Editori,,,,,https://farm1.staticflickr.com/827/41107828235_b45e9dcaee_z.jpg,Le neviere al Colle del Re per servire Barcellona Pozzo di Gotto e il suo territorio,,
14/05/2018 0.47.19,antonino.galante@gmail.com,Pippo Lo Cascio,Scale Neviere Trazzere,ISSPE - Istituto Siciliano Studi Politici ed Economici,,,,,https://farm1.staticflickr.com/949/41107828775_9a01ff8b01_z.jpg,"Le vie storiche di comunicazione, commerci ed economie della provincia palermitana, tra i secoli XIV - XIX",,
14/05/2018 0.52.13,antonino.galante@gmail.com,Antonio Patanè,I viaggi della neve,Archivio Mediterranea,,,,,https://farm1.staticflickr.com/968/41107829225_86636e4b48_z.jpg,"Raccolta, commercio e consumo della neve dell'Etna nei secoli XVII - XX",,
14/05/2018 0.58.15,antonino.galante@gmail.com,Giuseppe Cultrera,L'industria della neve,Utopia Edizioni,,,,,https://farm1.staticflickr.com/827/41107829795_f8596b9581_z.jpg,Neviere degli Iblei,,
14/05/2018 1.02.30,antonino.galante@gmail.com,Luigi Lombardo,La via del freddo,in proprio,,,,,https://farm1.staticflickr.com/978/41107830315_9d1b1c293a_z.jpg,Itinerari fra le neviere di Buccheri e dell'Altipiano ibleo siracusano,,
14/05/2018 1.05.01,antonino.galante@gmail.com,Luigi Lombardo,L'impresa della neve in Sicilia,Le Fate Editore,,,,,https://farm1.staticflickr.com/827/41107830765_0e71f52412_z.jpg,Tra lusso e consumo di massa,,
14/05/2018 1.08.16,antonino.galante@gmail.com,Luigi Romana,Neviere e nevaioli,Parco delle Madonie,,,,,https://farm1.staticflickr.com/943/41107831685_407e5ebb5e_z.jpg,La conserva e il commercio della neve nella Sicilia centro-occidentale (1500 - 1900),,
15/05/2018 1.31.57,antonino.galante@gmail.com,Autori Vari,I percorsi della neve,Regione Siciliana,,,,,https://farm1.staticflickr.com/953/40309006900_df935989f7_z.jpg,raccolta commercio consumo,,
